<?xml version="1.0" encoding="UTF-8"?>
<busStationReservationSystem systemID="67893"
                             xmlns:xsi="http://www.w3.org/2001/XMLSchema-instance"
                             xsi:noNamespaceSchemaLocation="projectSchema.xsd">

    <stationInfo stationID="S005">
        <stationName>Автогара Русе</stationName>
        <location>
            <city>Русе</city>
            <address>бул. България 45</address>
        </location>
        <contactNumber>082654321</contactNumber>
    </stationInfo>

    <buses>
        <bus busID="B005" available="true" capacity="60">
            <busNumber>RS3456MN</busNumber>
            <driver driverID="D005">
                <name>Николай Павлов</name>
                <licenseNumber>BG34567</licenseNumber>
            </driver>
            <seats>
                <seat>
                    <seatNumber>5</seatNumber>
                    <isAvailable>false</isAvailable>
                </seat>
                <seat>
                    <seatNumber>6</seatNumber>
                    <isAvailable>true</isAvailable>
                </seat>
            </seats>
            <routes>
                <route>
                    <startPoint>Русе</startPoint>
                    <endPoint>Велико Търново</endPoint>
                    <departureTime>2024-12-05T08:30:00</departureTime>
                    <arrivalTime>2024-12-05T10:00:00</arrivalTime>
                </route>
            </routes>
        </bus>
    </buses>

    <reservations>
        <reservation status="pending">
            <reservationID>R005</reservationID>
            <customer>
                <name>Илияна Гешева</name>
                <contactNumber>0899887766</contactNumber>
                <email>ilyana.gesheva@example.com</email>
            </customer>
            <busID>B005</busID>
            <seatNumber>5</seatNumber>
            <reservationDate>2024-12-04T12:00:00</reservationDate>
        </reservation>
    </reservations>
</busStationReservationSystem>