<?xml version="1.0" encoding="UTF-8"?>
<busStationReservationSystem systemID="67890"
                             xmlns:xsi="http://www.w3.org/2001/XMLSchema-instance"
                             xsi:noNamespaceSchemaLocation="projectSchema.xsd">

    <stationInfo stationID="S002">
        <stationName>Южна Автогара</stationName>
        <location>
            <city>София</city>
            <address>ул. Тодор Каблешков 50</address>
        </location>
        <contactNumber>029876543</contactNumber>
    </stationInfo>

    <buses>
        <bus busID="B002" available="true" capacity="30">
            <busNumber>CB2345KL</busNumber>
            <driver driverID="D002">
                <name>Георги Георгиев</name>
                <licenseNumber>BG54321</licenseNumber>
            </driver>
            <seats>
                <seat>
                    <seatNumber>1</seatNumber>
                    <isAvailable>false</isAvailable>
                </seat>
                <seat>
                    <seatNumber>2</seatNumber>
                    <isAvailable>true</isAvailable>
                </seat>
            </seats>
            <routes>
                <route>
                    <startPoint>София</startPoint>
                    <endPoint>Бургас</endPoint>
                    <departureTime>2024-12-02T09:00:00</departureTime>
                    <arrivalTime>2024-12-02T14:30:00</arrivalTime>
                </route>
            </routes>
        </bus>
    </buses>

    <reservations>
        <reservation status="cancelled">
            <reservationID>R002</reservationID>
            <customer>
                <name>Анна Димитрова</name>
                <contactNumber>0899988776</contactNumber>
                <email>anna.dimova@example.com</email>
            </customer>
            <busID>B002</busID>
            <seatNumber>1</seatNumber>
            <reservationDate>2024-11-30T11:00:00</reservationDate>
        </reservation>
    </reservations>
</busStationReservationSystem>