<?xml version="1.0" encoding="UTF-8"?>
<busStationReservationSystem systemID="67891"
                             xmlns:xsi="http://www.w3.org/2001/XMLSchema-instance"
                             xsi:noNamespaceSchemaLocation="projectSchema.xsd">

    <stationInfo stationID="S003">
        <stationName>Автогара Варна</stationName>
        <location>
            <city>Варна</city>
            <address>бул. Владислав Варненчик 231</address>
        </location>
        <contactNumber>052987654</contactNumber>
    </stationInfo>

    <buses>
        <bus busID="B003" available="false" capacity="45">
            <busNumber>VA5678GH</busNumber>
            <driver driverID="D003">
                <name>Мартин Стоянов</name>
                <licenseNumber>BG67890</licenseNumber>
            </driver>
            <seats>
                <seat>
                    <seatNumber>1</seatNumber>
                    <isAvailable>false</isAvailable>
                </seat>
                <seat>
                    <seatNumber>2</seatNumber>
                    <isAvailable>true</isAvailable>
                </seat>
            </seats>
            <routes>
                <route>
                    <startPoint>Варна</startPoint>
                    <endPoint>Бургас</endPoint>
                    <departureTime>2024-12-03T12:00:00</departureTime>
                    <arrivalTime>2024-12-03T15:00:00</arrivalTime>
                </route>
            </routes>
        </bus>
    </buses>

    <reservations>
        <reservation status="confirmed">
            <reservationID>R003</reservationID>
            <customer>
                <name>Елена Иванова</name>
                <contactNumber>0888999999</contactNumber>
                <email>elena.ivanova@example.com</email>
            </customer>
            <busID>B003</busID>
            <seatNumber>1</seatNumber>
            <reservationDate>2024-12-02T10:00:00</reservationDate>
        </reservation>
    </reservations>
</busStationReservationSystem>